<?xml version='1.0' encoding='UTF-8'?>
<dataset xmlns:xsi="http://www.w3.org/2001/XMLSchema-instance"
	xsi:noNamespaceSchemaLocation="dbxsd/dataset.xsd">
	
   <users Userid="1" UserName="Jim" password="19990101"/>
   <users Userid="2" UserName="Tom" password="78451891"/>
   <users Userid="3" UserName="Marta" password="198425oo1"/>
   
   <roles RoleId="1" RoleName="Admin"/>
   <roles RoleId="2" RoleName="Looser"/>
   
   <user_role IdUR="1" UserId="1" RoleId="1"/>
   <user_role IdUR="2" UserId="2" RoleId="2"/>
   <user_role IdUR="3" UserId="2" RoleId="2"/>
   
   <criminal CriminalId="1" Name="Kevin" SurName="Mitnik" BirthDay="1970-01-04"/>
   <criminal CriminalId="2" Name="Bobo" SurName="Little" BirthDay="1974-11-14"/>
   
   <criminalevents EventId="1" EventName="Vzlom" EventDescription="Broke telefon box" EventDate="2015-08-03" CriminalId="1" UserId="2"/>
   <criminalevents EventId="2" EventName="Ograblenie" EventDescription="Ograblenie JP Morgan bank" EventDate="2014-02-07"/>
   
</dataset>